<?xml version="1.0" encoding="UTF-8"?>
<!DOCTYPE auton SYSTEM "auton.dtd">
<auton>

<primitive id = "DRIVE_STOP_MECH"/>

<primitive id = "TRAJECTORY_DRIVE"
choreoname = "BlueRightNoneOutpostDepot_A"
time = "3.0"
intakeState = "STATE_INTAKE">
<zone filename = "BlueLaunchZone.xml"/>
<zone filename = "BlueOutpostZone.xml"/>
</primitive>

<primitive id = "TRAJECTORY_DRIVE"
choreoname = "BlueRightNoneOutpostDepot_B"
time = "3.0"
intakeState = "STATE_INTAKE">
<zone filename = "BlueLaunchZone.xml"/>
</primitive>

<primitive id = "TRAJECTORY_DRIVE"
choreoname = "BlueRightNoneOutpostDepot_C"
time = "3.0"
intakeState = "STATE_INTAKE">
<zone filename = "BlueLaunchZone.xml"/>
<zone filename = "BlueDepotZone.xml"/>
</primitive>

<primitive id = "DRIVE_STOP_MECH">
<zone filename = "BlueClimbingZone.xml"/>
</primitive>
<!--This path could honestly do a lot more, we could probably grab some pieces from our side if people are willing to pass-->



</auton>