<?xml version="1.0" encoding="UTF-8"?>
<!DOCTYPE auton SYSTEM "auton.dtd">
<auton>

<primitive id = "TRAJECTORY_DRIVE"
choreoname = "BlueRightBumpNZNZ_A"
time = "5.0">
<zone filename = "RedRightBumpZone.xml"/>
</primitive>


<primitive id = "TRAJECTORY_DRIVE"
choreoname = "RightToLeftNZ"
time = "5.0">
<zone filename = "RedLeftBumpZone.xml"/>
</primitive>


<primitive id = "TRAJECTORY_DRIVE"
choreoname = "BlueRightBumpNZNZ_C"
time = "5.0">
<zone filename = "RedLeftBumpZone.xml"/>
</primitive>


<primitive id = "TRAJECTORY_DRIVE"
choreoname = "LeftToRightNZ"
time = "5.0"/>
<primitive id = "TRAJECTORY_DRIVE"
choreoname = "BlueRightBumpNZNZ_E"
time = "5.0">
<zone filename = "RedRightBumpZone.xml"/>
</primitive>


<!--This path could honestly do a lot more, we could probably grab some pieces from our side if people are willing to pass-->



</auton>