<?xml version="1.0" encoding="UTF-8"?>
<!DOCTYPE auton SYSTEM "auton.dtd">
<auton>

<!-- <primitive id = "DRIVE_STOP_MECH"
time = "0.1"
intakeState = "STATE_OFF">
</primitive> -->

<primitive id = "TRAJECTORY_DRIVE"
choreoname = "BlueMRDrop3_Init"
time = "3.0">
<zone filename = "BlueRightBumpZoneRect.xml"/>
</primitive>

<primitive id = "TRAJECTORY_DRIVE"
choreoname = "BlueMRDrop3_A"
intakeState = "STATE_INTAKE"
time = "3.0">
</primitive>

<primitive id = "TRAJECTORY_DRIVE"
choreoname = "BlueMRDrop3_C"
time = "5.0">
<zone filename = "BlueRightBumpZone.xml"/>
<zone filename = "BlueLaunchZone.xml"/>
</primitive>

<primitive id = "DRIVE_STOP_MECH"
launcherState = "STATE_PREPARE_TO_LAUNCH"
time = "10.0">
</primitive>

<primitive id = "TRAJECTORY_DRIVE"
choreoname = "BlueMRDrop3_D"
time = "5.0"
intakeState = "STATE_INTAKE"
launcherState = "STATE_IDLE">
<zone filename = "BlueRightBumpZone.xml"/>
</primitive>

<primitive id = "TRAJECTORY_DRIVE"
choreoname = "BlueMRDrop3_E"
time = "5.0"
intakeState = "STATE_INTAKE">
</primitive>

<primitive id = "TRAJECTORY_DRIVE"
choreoname = "BlueMRDrop3_F"
time = "3.0">
<zone filename = "BlueLaunchZone.xml"/>
<zone filename = "BlueRightBumpZone.xml"/>
</primitive>

<primitive id = "DRIVE_STOP_MECH"
launcherState = "STATE_PREPARE_TO_LAUNCH"
time = "10.0">
</primitive>

</auton>