<?xml version="1.0" encoding="UTF-8"?>
<!DOCTYPE auton SYSTEM "auton.dtd">
<auton>

<primitive id = "TRAJECTORY_DRIVE"
choreoname = "BlueRightBumpNZNZ_A"
time = "2.0">
<zone filename = "BlueRightBumpZone.xml"/>
</primitive>

<primitive id = "TRAJECTORY_DRIVE"
choreoname = "RightToLeftNZ"
time = "3.0"/>

<primitive id = "TRAJECTORY_DRIVE"
choreoname = "BlueRightBumpNZNZ_C"
time = "1.5">
<zone filename = "BlueLeftBumpZone.xml"/>
</primitive>


<primitive id = "TRAJECTORY_DRIVE"
choreoname = "LeftToRightNZ"
time = "3.0">
<zone filename = "BlueRightBumpZone.xml"/>
</primitive>


<primitive id = "TRAJECTORY_DRIVE"
choreoname = "BlueRightBumpNZNZ_E"
time = "2.0"/>


<!--This path could honestly do a lot more, we could probably grab some pieces from our side if people are willing to pass-->



</auton>