<?xml version="1.0" encoding="UTF-8"?>
<!DOCTYPE auton SYSTEM "auton.dtd">
<auton>

<primitive id = "TRAJECTORY_DRIVE"
choreoname = "BlueMRDrop3_A"
time = "3.0"
intakeState = "STATE_INTAKE">
<zone filename = "BlueRightBumpZone.xml"/>
</primitive>

<primitive id = "TRAJECTORY_DRIVE"
choreoname = "BlueMRDrop3_B"
time = "5.0"
intakeState = "STATE_INTAKE">
</primitive>

<primitive id = "TRAJECTORY_DRIVE"
choreoname = "BlueMRDrop3_C"
time = "5.0">
<zone filename = "BlueRightBumpZone.xml"/>
<zone filename = "BlueLaunchZone.xml"/>
</primitive>

<primitive id = "DRIVE_STOP_MECH"
time = "5.0">
<zone filename = "BlueLaunchZone.xml"/>
</primitive>

<primitive id = "TRAJECTORY_DRIVE"
choreoname = "BlueMRDrop3_D"
time = "5.0"
intakeState = "STATE_INTAKE"
launcherState = "STATE_IDLE">
<zone filename = "BlueRightBumpZone.xml"/>
</primitive>

<primitive id = "TRAJECTORY_DRIVE"
choreoname = "BlueMRDrop3_E"
time = "5.0"
intakeState = "STATE_INTAKE">
<zone filename = "BlueLaunchZone.xml"/>
</primitive>

<primitive id = "TRAJECTORY_DRIVE"
choreoname = "BlueMRDrop3_E2"
time = "5.0"
intakeState = "STATE_INTAKE">
</primitive>

<primitive id = "TRAJECTORY_DRIVE"
choreoname = "BlueMRDrop3_F"
time = "3.0"
intakeState = "STATE_INTAKE">
<zone filename = "BlueRightBumpZone.xml"/>
</primitive>

<primitive id = "DRIVE_STOP_MECH"
time = "5.0">
<zone filename = "BlueLaunchZone.xml"/>
</primitive>

</auton>