<?xml version="1.0" encoding="UTF-8"?>
<!DOCTYPE auton SYSTEM "auton.dtd">
<auton>

<primitive id = "TRAJECTORY_DRIVE"
choreoname = "BlueMLDrop2_A"
time = "4.0"
intakeState = "STATE_INTAKE">
<zone filename = "RedLeftBumpZone.xml"/>
</primitive>

<primitive id = "TRAJECTORY_DRIVE"
choreoname = "BlueMLDrop2_B"
time = "4.0"
intakeState = "STATE_INTAKE">
<zone filename = "RedRightBumpZone.xml"/>
<zone filename = "RedLaunchZone.xml"/>
</primitive>

<primitive id = "TRAJECTORY_DRIVE"
choreoname = "BlueMLDrop2_C"
time = "4.0">
<zone filename = "RedRightBumpZone.xml"/>
<zone filename = "RedLaunchZone.xml"/>
</primitive>

<primitive id = "TRAJECTORY_DRIVE"
choreoname = "BlueMLDrop2_D"
time = "4.0"
intakeState = "STATE_INTAKE">
<zone filename = "RedLeftBumpZone.xml"/>
<zone filename = "RedLaunchZone.xml"/>
</primitive>

</auton>