<?xml version="1.0" encoding="UTF-8"?>
<!DOCTYPE auton SYSTEM "auton.dtd">
<auton>

<!-- <primitive id = "DRIVE_STOP_MECH"
time = "0.1"
intakeState = "STATE_OFF">
</primitive> -->

<snippet file = "RightBumpInit.xml"/>

<primitive id = "TRAJECTORY_DRIVE"
choreoname = "BlueMLDrop3_A"
time = "3.0"
intakeState = "STATE_INTAKE">
</primitive>

<primitive id = "TRAJECTORY_DRIVE"
choreoname = "BlueMLDrop3_C"
time = "5.0">
<zone filename = "RedLeftBumpZoneRect.xml"/>
<zone filename = "RedLaunchZone.xml"/>
</primitive>

<snippet file = "GoToDepot.xml"/>

<primitive id = "TRAJECTORY_DRIVE"
choreoname = "BlueMLDrop3_C2"
time = "5.0"
intakeState = "STATE_INTAKE"
launcherState = "STATE_IDLE">
<zone filename = "RedLeftBumpZoneRect.xml"/>
</primitive>

<primitive id = "TRAJECTORY_DRIVE"
choreoname = "BlueMLDrop3_D"
time = "5.0"
intakeState = "STATE_INTAKE">
</primitive>

<primitive id = "TRAJECTORY_DRIVE"
choreoname = "BlueMLDrop3_F"
time = "5.0"
intakeState = "STATE_INTAKE">
<zone filename = "RedLeftBumpZoneRect.xml"/>
<zone filename = "RedLaunchZone.xml"/>
</primitive>

<primitive id = "DRIVE_STOP_MECH"
time = "5.0">
</primitive>

</auton>