<?xml version="1.0" encoding="UTF-8"?>
<!DOCTYPE auton SYSTEM "auton.dtd">
<auton>

<primitive id = "TRAJECTORY_DRIVE"
choreoname = "BlueMRDrop2_A"
time = "5.0"
intakeState = "STATE_INTAKE">
<zone filename = "RedRightBumpZone.xml"/>
</primitive>

<primitive id = "TRAJECTORY_DRIVE"
choreoname = "BlueMRDrop2_B"
time = "5.0"
intakeState = "STATE_INTAKE">
<zone filename = "RedLaunchZone.xml"/>
</primitive>

<primitive id = "TRAJECTORY_DRIVE"
choreoname = "BlueMRDrop2_C"
time = "5.0">
<zone filename = "RedLeftBumpZone.xml"/>
<zone filename = "RedLaunchZone.xml"/>
</primitive>

<primitive id = "TRAJECTORY_DRIVE"
choreoname = "BlueMRDrop2_D"
time = "5.0"
intakeState = "STATE_INTAKE">
<zone filename = "RedRightBumpZone.xml"/>
<zone filename = "RedLaunchZone.xml"/>
</primitive>

<primitive id = "TRAJECTORY_DRIVE"
choreoname = "BlueMRDrop2_E"
time = "5.0"
intakeState = "STATE_INTAKE">
<zone filename = "RedLaunchZone.xml"/>
</primitive>

<primitive id = "TRAJECTORY_DRIVE"
choreoname = "BlueMRDrop2_F"
time = "5.0"
intakeState = "STATE_INTAKE">
<zone filename = "RedRightBumpZone.xml"/>
<zone filename = "RedLaunchZone.xml"/>
</primitive>

</auton>