<?xml version="1.0" encoding="UTF-8"?>
<!DOCTYPE auton SYSTEM "auton.dtd">
<auton>



<primitive id = "TRAJECTORY_DRIVE"
choreoname = "BlueLeftBumpNZNZ_A"
time = "2.0"
intakeState = "STATE_INTAKE">
<zone filename = "BlueLeftBumpZone.xml"/>
<zone filename = "BlueLaunchZone.xml"/>
</primitive>

<primitive id = "TRAJECTORY_DRIVE"
choreoname = "LeftToRightNZ"
time = "3.0"
intakeState = "STATE_INTAKE">
<zone filename = "BlueRightBumpZone.xml"/>
<zone filename = "BlueLaunchZone.xml"/>
</primitive>

<!-- <primitive id = "TRAJECTORY_DRIVE"
choreoname = "BlueLeftBumpNZNZ_C"
time = "1.5"> -->
<!-- 
</primitive> -->

<primitive id = "TRAJECTORY_DRIVE"
choreoname = "RightToLeftNZ"
time = "3.0"
intakeState = "STATE_INTAKE">
<zone filename = "BlueLeftBumpZone.xml"/>
</primitive>

<primitive id = "TRAJECTORY_DRIVE"
choreoname = "BlueLeftBumpNZNZ_D"
time = "2.0">
<zone filename = "BlueLaunchZone.xml"/>
</primitive>

<!--This path could honestly do a lot more, we could probably grab some pieces from our side if people are willing to pass-->



</auton>