<?xml version="1.0" encoding="UTF-8"?>
<!DOCTYPE auton SYSTEM "auton.dtd">
<auton>


<primitive id = "TRAJECTORY_DRIVE"
choreoname = "BlueLeftBumpNZNZ_A"
time = "2.0"
intakeState = "STATE_INTAKE">
<zone filename = "BlueLeftBumpNZNZ_A.xml"/>
</primitive>


<primitive id = "TRAJECTORY_DRIVE"
choreoname = "LeftToRightNZ"
time = "5.0"
intakeState = "STATE_INTAKE">
<zone filename = "LeftToRightNZ.xml"/>
</primitive>


<primitive id = "TRAJECTORY_DRIVE"
choreoname = "BlueLeftBumpNZNZ_C"
time = "5.0">
<zone filename = "RedLaunchZone.xml"/>
</primitive>

<primitive id = "TRAJECTORY_DRIVE"
choreoname = "RightToLeftNZ"
time = "5.0"
intakeState = "STATE_INTAKE">
<zone filename = "RightToLeftNZ.xml"/>
</primitive>


<primitive id = "TRAJECTORY_DRIVE"
choreoname = "BlueLeftBumpNZNZ_D"
time = "5.0">
<zone filename = "RedLaunchZone.xml"/>
</primitive>

<!--This path could honestly do a lot more, we could probably grab some pieces from our side if people are willing to pass-->



</auton>